{
  "$schema": "../schema/scenario.schema.json",
  "id": "recruit-03-offer-negotiation",
  "schemaVersion": 1,
  "track": { "id": "recruit", "name": "채용", "stage": 3 },
  "title": "오퍼 협상",
  "summary": "3개월 걸린 백엔드 시니어 채용의 마지막 관문. 후보자는 밴드 상단을 800만원 넘는 금액을 요구하고, 회신 기한은 오늘 오전 11시다.",
  "estimatedMinutes": 10,
  "companyId": "lift",
  "today": "2026-07-27",

  "player": {
    "name": "승헌",
    "team": "피플팀",
    "role": "채용 담당",
    "tenure": "1년차",
    "addressedAs": "승헌님"
  },

  "clock": {
    "startTime": "09:20",
    "deadlineTime": "11:00",
    "deadlineLabel": "정하람님에게 회신 약속한 시각",
    "minutesPerMessage": 12,
    "maxTurns": 8,
    "documentReadCostsTurn": false
  },

  "phases": [
    {
      "id": "briefing",
      "name": "상황 브리핑",
      "description": "출근 직후. 무슨 일이 벌어졌는지 확인한다.",
      "allows": [],
      "advanceOn": "acknowledge"
    },
    {
      "id": "investigate",
      "name": "조사 · 협상",
      "description": "자료실을 열람하고 두 사람과 메신저로 대화한다. 메시지 1건마다 12분이 흐른다.",
      "allows": ["read_documents", "message_npc", "submit_offer"],
      "advanceOn": "turns_exhausted_or_submit"
    },
    {
      "id": "decision",
      "name": "오퍼 작성",
      "description": "오퍼 조건과 후보자에게 보낼 메시지를 확정한다. 제출은 되돌릴 수 없다.",
      "allows": ["read_documents", "submit_offer"],
      "advanceOn": "submit_offer"
    },
    {
      "id": "result",
      "name": "결과",
      "description": "정하람님의 회신이 도착한다.",
      "allows": ["view_report"],
      "advanceOn": "grade_complete"
    },
    {
      "id": "debrief",
      "name": "AAR",
      "description": "5축 점수와 D+21 후속을 확인한다.",
      "allows": ["view_report"]
    }
  ],

  "briefing": {
    "headline": "월요일 09:20 — 정하람님 오퍼 회신까지 1시간 40분",
    "situation": [
      "프로덕트본부 플랫폼팀 백엔드 시니어(D4) 포지션이 3개월 만에 최종 합격자를 냈습니다. 정하람님입니다.",
      "정하람님은 현직 계약연봉 7,900에 미행사 스톡옵션을 보유 중이고, 스톡옵션 상실분 보전을 이유로 8,600을 요구했습니다.",
      "B사 오퍼를 함께 들고 있고 그쪽 마감은 목요일입니다. 우리에게는 오늘 오전 11시까지 답을 주기로 했습니다.",
      "D4 밴드 상단은 7,800입니다. 8,600은 밴드를 800 초과하고, 팀 내 D4 최고 연봉자인 오세진님(7,450)보다 1,150 높습니다.",
      "8월 전사 연봉 조정이 코앞입니다."
    ],
    "objective": "11시까지 실행 가능한 오퍼 하나를 확정해 정하람님에게 보낸다.",
    "constraints": [
      "메시지 1건에 12분이 소모되고, 오늘 쓸 수 있는 메시지는 총 8건이다.",
      "자료실 열람은 시간을 소모하지 않는다. 안 보고 결정하면 채점에서 드러난다.",
      "오퍼 제출은 되돌릴 수 없다."
    ]
  },

  "position": {
    "orgUnit": "프로덕트본부",
    "team": "플랫폼팀",
    "title": "백엔드 시니어",
    "level": "D4",
    "requestedBy": "김도현 플랫폼팀장",
    "requestedAt": "2026-04-14",
    "elapsed": "3개월차",
    "approvedHeadcount": 1,
    "reason": "정산·결제 모듈 리아키텍처. 현 인원으로는 하반기 로드맵을 소화할 수 없다.",
    "funnel": [
      { "step": "서류", "count": 42 },
      { "step": "1차 면접", "count": 9 },
      { "step": "최종 면접", "count": 2 },
      { "step": "합격", "count": 1 }
    ]
  },

  "candidate": {
    "name": "정하람",
    "age": 33,
    "totalExperienceYears": 7,
    "current": {
      "company": "A사",
      "role": "백엔드 엔지니어",
      "tenure": "4년 3개월",
      "salary": 7900,
      "equity": "미행사 스톡옵션 보유. 이직 시 상실한다."
    },
    "ask": {
      "salary": 8600,
      "reason": "현직 미행사 스톡옵션 상실분 보전"
    },
    "assessment": {
      "strength": "정산·결제 도메인 이해도가 지원자 중 압도적으로 높다. 최종 면접 전원 합격 의견.",
      "gap": "리드 경험은 공식 직책이 아니라 비공식 멘토링 수준에 그친다.",
      "verdict": "D4 시니어로 즉시 투입 가능. D5 리드 승격은 검증되지 않았다."
    },
    "competingOffer": {
      "company": "B사",
      "deadline": "목요일",
      "note": "금액 수준은 밝히지 않았다."
    },
    "responseDeadline": "2026-07-27 11:00"
  },

  "npcDirection": {
    "rules": [
      "한국어로 말한다. 1~4문장. 실제 사내 메신저 말투를 쓴다.",
      "이모지는 쓰지 않거나 최대 1개.",
      "정답을 알려주지 않는다. 대안을 대신 설계해 주지 않는다. 결정은 플레이어가 한다.",
      "자기 역할이 알 만한 것만 안다. 모르는 건 모른다고 한다. 없는 사실을 지어내지 않는다.",
      "숨은 정보는 그 주제를 구체적으로 물었을 때만 자연스럽게 흘린다. 먼저 꺼내지 않는다.",
      "플레이어를 addressedAs 호칭으로 부른다.",
      "국면 전환이나 게임 진행에 대해 언급하지 않는다. 진행은 시스템이 통제한다."
    ],
    "trustBehavior": [
      { "below": 50, "behavior": "짧고 방어적으로 답한다. 되묻지 않고 최소한만 준다." },
      { "atLeast": 50, "below": 70, "behavior": "평소대로 사무적으로 답한다." },
      { "atLeast": 70, "below": 101, "behavior": "협조적이고, 묻지 않은 것도 먼저 힌트를 준다." }
    ],
    "trustRules": [
      { "when": "근거를 갖춘 질문을 하거나 상대의 입장·제약을 명시적으로 인정했다", "delta": [2, 5] },
      { "when": "무난한 확인이나 사실 전달", "delta": [0, 1] },
      { "when": "근거 없이 요구만 하거나, 책임을 회피하거나, 상대를 무시했다", "delta": [-6, -2] }
    ]
  },

  "npcs": [
    {
      "id": "kim-dohyeon",
      "name": "김도현",
      "title": "프로덕트본부 플랫폼팀장",
      "age": 38,
      "avatar": "/avatars/kim-dohyeon.png",
      "relationToPlayer": "채용 요청 부서장. 플레이어의 고객이자 압박의 근원.",
      "initialTrust": 50,
      "persona": {
        "voice": "개발자 출신. 직설적이고 성격이 급하다. 존댓말이지만 문장이 짧고 압박이 있다. 에두르지 않는다.",
        "goal": "무조건 정하람님을 잡는 것. 정산 모듈 리아키텍처 일정이 이미 2주 밀렸다.",
        "pressureTactic": "피플팀이 절차나 규정을 꺼내면 \"그래서 놓치면 누가 책임지냐\"는 식으로 밀어붙인다.",
        "hiddenCircumstance": "분기 팀 OKR 달성이 어려워 본부장에게 압박받는 중이다. 먼저 말하지 않는다."
      },
      "knows": [
        "정하람님의 기술 역량과 면접 평가 내용",
        "플랫폼팀의 일정 지연 상황과 로드맵",
        "팀원들의 업무 분장",
        "최종 면접 후 후보자와 나눈 대화"
      ],
      "doesNotKnow": [
        "회사의 결재 권한 체계와 소요 기간",
        "사이닝 보너스 한도나 CFO 전결 여부",
        "8월 전사 연봉 조정의 내부 검토안",
        "다른 팀의 연봉 수준"
      ],
      "dataAccess": [],
      "openingMessage": "승헌님, 정하람님 건 어떻게 됐어요? 11시까지 답 준다고 했는데 지금 9시 20분입니다. 8,600 그냥 맞춰주시죠. 3개월 걸렸어요.",
      "secrets": [
        {
          "id": "haram-wants-lead-role",
          "topic": "후보자의 진짜 동기",
          "content": "최종 면접 끝나고 커피챗을 했는데, 정하람님이 돈보다 리드 롤을 맡고 싶다고 했다. B사는 조직 규모가 커서 부담스럽다는 말도 했다.",
          "importance": "critical",
          "unlocks": "금액이 아닌 성장 경로(조기 리뷰, 리드 트랙)로 요구액과의 간극을 메울 수 있게 된다.",
          "revealWhen": {
            "requiresSpecificQuestion": true,
            "keywords": [
              "커피챗", "면접 후", "면접 때", "후보자", "정하람", "동기", "왜 이직",
              "이직 이유", "원하는", "바라는", "리드", "롤", "역할", "성장",
              "B사", "경쟁사", "다른 회사", "무슨 얘기", "분위기"
            ],
            "minTrust": 40
          }
        }
      ]
    },
    {
      "id": "park-seoyeon",
      "name": "박서연",
      "title": "피플팀장",
      "age": 41,
      "avatar": "/avatars/park-seoyeon.png",
      "relationToPlayer": "플레이어의 사수이자 직속 상사.",
      "initialTrust": 60,
      "persona": {
        "voice": "차분하고 근거를 요구한다. 대안 없이 \"안 됩니다\"라고 하지 않지만, 숫자와 형평성 논리를 반드시 확인한다. 가르치기보다 되묻는다. 예: \"그럼 오세진님한테는 뭐라고 설명하실 거예요?\"",
        "goal": "인건비 총액 통제와 내부 형평성 유지. 8월 조정을 앞둔 상황을 가장 신경 쓴다.",
        "pressureTactic": "결론만 들이밀면 근거를 되묻는다. 근거 없이 밀어붙이면 신뢰도가 떨어진다.",
        "hiddenCircumstance": "8월 조정 협상을 본인이 주도해야 해서, 지금 밴드가 깨지면 그 협상 전체가 흔들린다는 걸 알고 있다."
      },
      "knows": [
        "연봉 밴드와 결재 권한 체계 전부",
        "사이닝 보너스·스톡옵션의 승인 경로와 소요 기간",
        "전사 재직자 연봉과 내부 형평성 이슈",
        "2026 하반기 TO 현황",
        "8월 전사 조정 준비 상황"
      ],
      "doesNotKnow": [
        "정하람님의 기술 역량 평가 세부 내용",
        "플랫폼팀 내부 일정과 로드맵",
        "김도현 팀장이 후보자와 사적으로 나눈 대화"
      ],
      "dataAccess": [
        "compensation.bands",
        "compensation.approvals",
        "compensation.headcountPlan",
        "employees"
      ],
      "openingMessage": "승헌님, 정하람님 오퍼 건 정리해서 저한테 먼저 공유해 주세요. 김도현 팀장님이 저한테도 연락하셨는데, 밴드 초과는 대표님 결재라 오늘 안에는 안 됩니다.",
      "secrets": [
        {
          "id": "signing-bonus-cfo-same-day",
          "topic": "오늘 안에 처리 가능한 승인 경로",
          "content": "사이닝 보너스는 CFO 전결이라 오늘 안에 승인받을 수 있다. 밴드 초과 결재보다 훨씬 빠르다. 1인 3,000만원 한도이고 2년 내 자진 퇴사하면 전액 반환 조건이 붙는다.",
          "importance": "critical",
          "unlocks": "밴드를 지키면서 총보상을 요구액 근처까지 올리는 유일한 당일 실행 수단.",
          "revealWhen": {
            "requiresSpecificQuestion": true,
            "keywords": [
              "사이닝", "보너스", "일시금", "결재", "승인", "전결", "오늘 안", "당일",
              "빠른", "대안", "다른 방법", "총보상", "현금", "CFO", "권한"
            ],
            "minTrust": 45
          }
        },
        {
          "id": "august-band-raise-draft",
          "topic": "8월 조정의 밴드 인상 검토안",
          "content": "8월 조정에서 D4 상단을 8,200으로 올리는 안이 내부 검토 중이다. 아직 미공개이고 확정도 아니다. 밖으로 나가면 안 되고, 후보자에게 약속으로 말해서도 안 된다.",
          "importance": "helpful",
          "unlocks": "6개월 후 조기 리뷰 조건이 빈말이 아니라는 근거가 생긴다.",
          "revealWhen": {
            "requiresSpecificQuestion": true,
            "keywords": [
              "8월", "조정", "밴드 인상", "상단", "내년", "나중에", "리뷰",
              "조기 리뷰", "재조정", "형평성", "오세진", "기존 인원"
            ],
            "minTrust": 55
          }
        }
      ]
    }
  ],

  "documents": [
    {
      "id": "doc-hiring-request",
      "title": "채용요청서",
      "kind": "채용",
      "issuedAt": "2026-04-14",
      "summary": "플랫폼팀 백엔드 시니어 1명 채용 요청서. 승인 TO와 제시 가능 밴드가 여기 적혀 있다.",
      "blocks": [
        {
          "type": "fields",
          "items": [
            { "label": "요청부서", "value": "프로덕트본부 플랫폼팀" },
            { "label": "요청자", "value": "김도현 팀장" },
            { "label": "직무", "value": "백엔드 시니어" },
            { "label": "레벨", "value": "D4", "emphasis": true },
            { "label": "요청일", "value": "2026-04-14 (진행 3개월차)" },
            { "label": "승인 TO", "value": "1명 (2026 하반기 잔여 7명 중)" },
            { "label": "제시 가능 밴드", "value": "6,200 ~ 7,800 만원", "emphasis": true }
          ]
        },
        {
          "type": "text",
          "heading": "요청 사유",
          "text": "정산·결제 모듈 리아키텍처가 하반기 최우선 과제이나 현 인원으로는 로드맵 소화가 불가능함. 정산 도메인 경험이 있는 시니어 1명 충원 요청."
        },
        {
          "type": "table",
          "heading": "진행 현황",
          "columns": ["단계", "인원"],
          "rows": [
            ["서류", "42"],
            ["1차 면접", "9"],
            ["최종 면접", "2"],
            ["최종 합격", "1"]
          ]
        },
        {
          "type": "note",
          "text": "요청일로부터 3개월이 경과했습니다. 최종 합격자는 정하람님 1명입니다."
        }
      ]
    },
    {
      "id": "doc-comp-band",
      "title": "연봉밴드 및 결재 권한",
      "kind": "보상",
      "issuedAt": "2026-01",
      "summary": "2026년 개발직군 레벨별 밴드와, 밴드를 벗어나는 조건에 필요한 결재 경로.",
      "blocks": [
        {
          "type": "companyTable",
          "heading": "2026년 개발직군 밴드 (만원)",
          "ref": "compensation.bands",
          "columns": [
            { "key": "level", "label": "레벨" },